consumer_complaint_narrative,product,issue,company_name,date_received,clean_text,word_count,lda_topic,nmf_topic
"XXXX, XXXX XXXX SOC SEC # XXXX DOB XXXX/XXXX/XXXX ADDRESS XXXX XXXX XXXX XXXX, XXXX XXXX, FL XXXX Todays date : XXXX/XXXX/XXXX Your company have violated FCRA 615 ( f ) ( 15 U.S.C. XX/XX/XXXXm ( f ) ) ( f ) Prohibition on sale or transfer of debt caused by identity theft You have not responded to my request to provide me with an investigation report. 
I need this resolve, under the Fair Credit Reporting Act, these disputed items may not appear on my credit report if they can not be supported by any evidence ( 1 ) In general No person ( company ) shall sell, transfer for consideration, or place for collection a debt that such person has been notified under section XX/XX/XXXXc-2 of this title has resulted from identity theft. 
( 2 ) Applicability The prohibitions of this subsection shall apply to all persons collecting a debt described in paragraph ( 1 ) after the date of a notification under paragraph ( 1 ). 
( 3 ) Rule of construction Nothing in this subsection shall be construed to prohibit -- ( A ) The repurchase of a debt in any case in which the assignee of the debt requires such repurchase because the debt has resulted from identity theft ; ( B ) the securitization of a debt or the pledging of a portfolio of debt as collateral in connection with a borrowing ; or ( C ) the transfer of debt as a result of a merger, acquisition, purchase and assumption transaction, or transfer of substantially all of the assets of an entity. 
A person that furnishes information to any consumer reporting agency shall have in place reasonable procedures to respond to any notification that it receives from a consumer reporting agency under section XX/XX/XXXXc-2 of this title relating to information resulting from identity theft, to prevent that person from refurnishing such blocked information. 
The reference items are listed below please take this matter very serious ENHANCED RECOVERY CO XXXX I have report your company to consumerfinance.gov As a form of record and I am prepare to sue your company Example In re XXXX XXXX XXXX XXXX XXXX Telephone Consumer Protection Act Litigation, Case No. XXXX, in the XXXX Stop collection proceedings against me Signatures on applications and accounts Investigators report XXXX, XXXX XXXX SOC SEC # XXXX DOB XXXX/XXXX/XXXX ADDRESS XXXX XXXX XXXX XXXX, XXXX XXXXXXXX XXXX",Debt collection,Cont'd attempts collect debt not owed,ERC,3/3/2017,soc sec dob address todays date your company have violated fcra xxxxm prohibition sale transfer debt caused identity theft you have not responded request provide with investigation report need this resolve under the fair credit reporting act these disputed items may not appear credit report they can not supported any evidence general person company shall sell transfer for consideration place for collection debt that such person has been notified under section xxxxc this title has resulted from identity theft applicability the prohibitions this subsection shall apply all persons collecting debt described paragraph after the date notification under paragraph rule construction nothing this subsection shall construed prohibit the repurchase debt any case which the assignee the debt requires such repurchase because the debt has resulted from identity theft the securitization debt the pledging portfolio debt collateral connection with borrowing the transfer debt result merger acquisition purchase and assumption transaction transfer substantially all the assets entity person that furnishes information any consumer reporting agency shall have place reasonable procedures respond any notification that receives from consumer reporting agency under section xxxxc this title relating information resulting from identity theft prevent that person from refurnishing such blocked information the reference items are listed below please take this matter very serious enhanced recovery have report your company consumerfinance gov form record and prepare sue your company example telephone consumer protection act litigation case the stop collection proceedings against signatures applications and accounts investigators report soc sec dob address,244,4,2
"I had a collection from XXXX, I disputed it and XXXX found that I was correct, this was identity theft. since then I 've had XXXX companies try to collect the same debt, every 3-4 months I have to redispute with a diff company to have removed. this is dropping my score and interring with my life.",Debt collection,Cont'd attempts collect debt not owed,ERC,10/26/2015,had collection from disputed and found that was correct this was identity theft since then had companies try collect the same debt every months have redispute with diff company have removed this dropping score and interring with life,38,1,2
"Enhanced Recovery keeps billing for an old XXXX account that was discharged with a bankruptcy. XXXX used XXXX collection agencies, the other XXXX removed the information from my credit report after receiving my letters - Enhanced Recovery has not. I am attaching letter I sent to XXXX and to Enhanced Recovery requesting they remove this negative collections information from all XXXX credit bureaus. I have also made numerous, numerous phone calls both to XXXX and to Enhanced Recovery and I 'm always told the account will be removed from my credit report but it never gets done. Enhanced Recovery has violated the law by continuing to report this debt. I think the account # is XXXX ; however, Enhanced Recovery is using a different number that begins with XXXX.",Debt collection,Cont'd attempts collect debt not owed,ERC,4/3/2015,enhanced recovery keeps billing for old account that was discharged with bankruptcy used collection agencies the other removed the information from credit report after receiving letters enhanced recovery has not attaching letter sent and enhanced recovery requesting they remove this negative collections information from all credit bureaus have also made numerous numerous phone calls both and enhanced recovery and always told the account will removed from credit report but never gets done enhanced recovery has violated the law continuing report this debt think the account however enhanced recovery using different number that begins with,94,2,1
"My name is XXXX XXXX, and I am sending this request myself to address the inaccuracies on my Credit Reports.

Time has already passed but up until now, I havent heard any kind of response from the XXXX and XXXX Credit Bureaus which made me decide to seek assistance from you. They have shown negligence and an act of refusal of complying with my request. I know for a fact that they are to comply with the Fair Credit Reporting Act law, to provide proof, documents, and give definite and accurate responses, within the given statutory time. However, if they failed to do so, they are obliged to remove the account which is erroneous and unverified. Their unfavorable and unacceptable actions have been hurting my credit scores immensely. Please see below the account I am concerned of : ENHANCED RECOVERY CO L - XXXX",Debt collection,Attempts to collect debt not owed,ERC,11/5/2021,name and sending this request myself address the inaccuracies credit reports time has already passed but until now havent heard any kind response from the and credit bureaus which made decide seek assistance from you they have shown negligence and act refusal complying with request know for fact that they are comply with the fair credit reporting act law provide proof documents and give definite and accurate responses within the given statutory time however they failed they are obliged remove the account which erroneous and unverified their unfavorable and unacceptable actions have been hurting credit scores immensely please see below the account concerned enhanced recovery,105,2,3
"XXXX XXXX, XXXX SOC SEC # XXXX DOB XX/XX/1987 ADDRESS XXXX XXXX XXXX, XXXX, FL XXXX ERC XXXX Your company have violated FCRA 615 ( f ) ( 15 U.S.C. 1681m ( f ) ) ( f ) Prohibition on sale or transfer of debt caused by identity theft You have not responded to my request to provide me with an investigation report.

I need this resolve, under the Fair Credit Reporting Act, these disputed items may not appear on my credit report if they can not be supported by any evidence ( 1 ) In general No person ( company ) shall sell, transfer for consideration, or place for collection a debt that such person has been notified under section 1681c-2 of this title has resulted from identity theft.

( 2 ) Applicability The prohibitions of this subsection shall apply to all persons collecting a debt described in paragraph ( 1 ) after the date of a notification under paragraph ( 1 ). 
( 3 ) Rule of construction Nothing in this subsection shall be construed to prohibit -- ( A ) The repurchase of a debt in any case in which the assignee of the debt requires such repurchase because the debt has resulted from identity theft ; ( B ) the securitization of a debt or the pledging of a portfolio of debt as collateral in connection with a borrowing ; or ( C ) the transfer of debt as a result of a merger, acquisition, purchase and assumption transaction, or transfer of substantially all of the assets of an entity.

A person that furnishes information to any consumer reporting agency shall have in place reasonable procedures to respond to any notification that it receives from a consumer reporting agency under section 1681c-2 of this title relating to information resulting from identity theft, to prevent that person from refurnishing such blocked information. 
The reference items are listed below please take this matter very serious ERC XXXX I have report your company to consumerfinance.gov As a form of record and I am prepare to sue your company Example In re XXXX XXXX XXXX, XXXX Telephone Consumer Protection Act Litigation, Case No. 11-MD-2295-JAH-BGS, in the U.S. District Court for the Southern District of California Stop collection proceedings against me Signatures on applications and accounts Investigators report XXXX XXXX, XXXX SOC SEC # XXXX DOB XX/XX/1987 ADDRESS XXXX XXXX XXXX, XXXX, FL XXXX",Debt collection,Attempts to collect debt not owed,ERC,12/27/2020,soc sec dob address erc your company have violated fcra prohibition sale transfer debt caused identity theft you have not responded request provide with investigation report need this resolve under the fair credit reporting act these disputed items may not appear credit report they can not supported any evidence general person company shall sell transfer for consideration place for collection debt that such person has been notified under section this title has resulted from identity theft applicability the prohibitions this subsection shall apply all persons collecting debt described paragraph after the date notification under paragraph rule construction nothing this subsection shall construed prohibit the repurchase debt any case which the assignee the debt requires such repurchase because the debt has resulted from identity theft the securitization debt the pledging portfolio debt collateral connection with borrowing the transfer debt result merger acquisition purchase and assumption transaction transfer substantially all the assets entity person that furnishes information any consumer reporting agency shall have place reasonable procedures respond any notification that receives from consumer reporting agency under section this title relating information resulting from identity theft prevent that person from refurnishing such blocked information the reference items are listed below please take this matter very serious erc have report your company consumerfinance gov form record and prepare sue your company example telephone consumer protection act litigation case jah bgs the district court for the southern district california stop collection proceedings against signatures applications and accounts investigators report soc sec dob address,248,4,2
"My name is ( XXXX XXXX ), a federally protected consumer, and I am making this complaint against ( Enhanced Recovery Company ) for committing identity theft. I have never given ( Enhanced Recovery Company ) any permission to use any of my identifying information to commit mail fraud by contacting me about an alleged debt they claim I owe. I am aware that the that in accordance with Article 9, the assignment of a defaulted note is illegal. Both the assignee and the assigned are both liable for violations under 15 U.S. Code 1692e ( 12 ).

I have never received any documentation requesting validation from ( Enhanced Recovery Company ) before they committed multiple violations under the FCRA and the FDCPA by furnishing this alleged debt to my consumer report including but not limited to 15 U.S. Code 1692d ( 4 ) which the FTC defines as debt parking. If ( Enhanced Recovery Company ) can not provide me with proof such as a tracking number that they attempted to lawfully validate this alleged debt with me, the consumer, prior to furnishing it on my consumer report, this has been a fraudulently furnished account with forethought and malice as an attempt to bring harm to me and my financial reputation.

I am legally refusing to pay this debt pursuant to 1692c ( c ). I am demanding a cease and desist of all illegal activity, any communication and collection activity, of this and any alleged debts until ( Enhanced Recovery Company ) can provide me with sufficient documentary evidence that I have any legal obligation to pay them. If this documentary evidence can not be produced and ( Enhanced Recovery Company ) continues its collection efforts, I will file for litigation for actual damages caused and ( Enhanced Recovery Company ) will be held criminally liable for aggravated identity theft pursuant to 18 USC 1028A, extortion, theft by deception, securities fraud, and mail fraud. Upon the receipt of the documents herein and of this notice, you are hereby notified Pursuant UCC 1-202f. Your prompt attention and response are both requested and required.",Debt collection,Attempts to collect debt not owed,ERC,3/27/2022,name federally protected consumer and making this complaint against enhanced recovery company for committing identity theft have never given enhanced recovery company any permission use any identifying information commit mail fraud contacting about alleged debt they claim owe aware that the that accordance with article the assignment defaulted note illegal both the assignee and the assigned are both liable for violations under code have never received any documentation requesting validation from enhanced recovery company before they committed multiple violations under the fcra and the fdcpa furnishing this alleged debt consumer report including but not limited code which the ftc defines debt parking enhanced recovery company can not provide with proof such tracking number that they attempted lawfully validate this alleged debt with the consumer prior furnishing consumer report this has been fraudulently furnished account with forethought and malice attempt bring harm and financial reputation legally refusing pay this debt pursuant demanding cease and desist all illegal activity any communication and collection activity this and any alleged debts until enhanced recovery company can provide with sufficient documentary evidence that have any legal obligation pay them this documentary evidence can not produced and enhanced recovery company continues its collection efforts will file for litigation for actual damages caused and enhanced recovery company will held criminally liable for aggravated identity theft pursuant usc extortion theft deception securities fraud and mail fraud upon the receipt the documents herein and this notice you are hereby notified pursuant ucc your prompt attention and response are both requested and required,253,5,3
"Enhanced Recovery Company put a collection on my credit report preventing me from getting access to credit.

Enhanced Recovery Company placed a collection of {$170.00} with no payment history on my credit report XX/XX/2019. 

Enhanced Recovery Company ( XXXX ) XXXX",Debt collection,Attempts to collect debt not owed,ERC,1/29/2022,enhanced recovery company put collection credit report preventing from getting access credit enhanced recovery company placed collection with payment history credit report enhanced recovery company,25,1,4
No information given regarding account. Violates federal 15 USC 1692gf and 15 USC Section 1681 ( i ). The bureaus have it reporting different pricing and multiple inaccuracies. I never authorized or given permission for this to be reporting. its been 2 months and no information given. No medical release to collect on this debt either No information given regarding account. Violates federal 15 USC 1692gf and 15 USC Section 1681 ( i ). The bureaus have it reporting different pricing and multiple inaccuracies. I never authorized or given permission for this to be reporting. its been 2 months and no information given. No medical release to collect on this debt either,Debt collection,Attempts to collect debt not owed,ERC,7/11/2021,information given regarding account violates federal usc and usc section the bureaus have reporting different pricing and multiple inaccuracies never authorized given permission for this reporting its been months and information given medical release collect this debt either information given regarding account violates federal usc and usc section the bureaus have reporting different pricing and multiple inaccuracies never authorized given permission for this reporting its been months and information given medical release collect this debt either,76,1,3
"As I have not heard back from you in over 60 days, regarding my demand for proof, since my notice of my dispute and you have not supplied the demanded proof of the alleged debt, under the doctrine of estoppel by silence, XXXX XXXX XXXX ( Mo ) XXXX XXXX XXXX, XXXX, I may presume that no proof of the alleged debt, nor therefore any such debt, in fact exists. 


In a good faith effort to resolve this matter amicably, I restate my demand for proof of the debt, specifically the alleged contract or other instrument bearing my signature, as well as proof of your authority in this matter. Absent such proof, you must terminate this collection action and correct any erroneous reports of this debt as mine. 

For the record, I state again that as I have no account with you, nor am I your customer, nor have I entered into a contract with you, I must ask for the following information : 1 ) Please evidence your authorization under 15 USC 1692 ( e ) and 15 USC 1692 ( f ) in this alleged matter.

2 ) What is your authorization of law for your collection of information?

3 ) What is your authorization of law for your collection of this alleged debt?

4 ) Please evidence your authorization to do business or operate in the state.

5 ) Please evidence proof of the alleged debt, including specifically the alleged contract or other instrument bearing my signature. 

You have 15 days of this notice to respond. Your failure to respond, on point, in writing, hand signed, and in a timely manner, will work as a waiver to any and all of your claims in this matter, and will entitle me to presume that you sent your letter ( s ) in error, and that this matter is permanently closed. 

Your continued silence is unacceptable. Either provide the proof or correct the record to remove the invalid debt from my credit files with the three-primary credit-reporting agencies. You are currently in violation of the Fair Credit Reporting Act and the Fair Debt Collection Act. 

Failure to respond within 15 days of this letter will begin my small claims action against your company. I will be seeking {$5000.00} in damages for the following : 1 ) Defamation 2 ) Negligent Enablement of Identity Fraud 3 ) Violation of the Fair Credit Reporting Act After obtaining the judgment against your company, I will obtain a Writ of Execution from the Sheriffs office in your county and I will begin the process of attaching property or funds to satisfy the judgment. 

For the purposes of 15 USC 1692 et seq., this Notice has the same effect as a dispute to the validity of the alleged debt and a dispute to the validity of your claims. This Notice is an attempt to correct your records, and any information received from you will be collected as evidence should any further action be necessary. This is a request for information only, and is not a statement, election, or waiver of status.",Debt collection,Attempts to collect debt not owed,ERC,1/25/2022,have not heard back from you over days regarding demand for proof since notice dispute and you have not supplied the demanded proof the alleged debt under the doctrine estoppel silence may presume that proof the alleged debt nor therefore any such debt fact exists good faith effort resolve this matter amicably restate demand for proof the debt specifically the alleged contract other instrument bearing signature well proof your authority this matter absent such proof you must terminate this collection action and correct any erroneous reports this debt mine for the record state again that have account with you nor your customer nor have entered into contract with you must ask for the following information please evidence your authorization under usc and usc this alleged matter what your authorization law for your collection information what your authorization law for your collection this alleged debt please evidence your authorization business operate the state please evidence proof the alleged debt including specifically the alleged contract other instrument bearing signature you have days this notice respond your failure respond point writing hand signed and timely manner will work waiver any and all your claims this matter and will entitle presume that you sent your letter error and that this matter permanently closed your continued silence unacceptable either provide the proof correct the record remove the invalid debt from credit files with the three primary credit reporting agencies you are currently violation the fair credit reporting act and the fair debt collection act failure respond within days this letter will begin small claims action against your company will seeking damages for the following defamation negligent enablement identity fraud violation the fair credit reporting act after obtaining the judgment against your company will obtain writ execution from the sheriffs office your county and will begin the process attaching property funds satisfy the judgment for the purposes usc seq this notice has the same effect dispute the validity the alleged debt and dispute the validity your claims this notice attempt correct your records and any information received from you will collected evidence should any further action necessary this request for information only and not statement election waiver status,362,4,3
