consumer_complaint_narrative,product,issue,company_name,date_received,clean_text,word_count,lda_topic,nmf_topic
"I have reached out to XXXX and Enhanced Recovery on multiple occasions, through several different avenues, throughout this past year in attempt to dispute the following information that appears on my XXXX or XXXX and/or XXXX XXXX report ( XXXX ) : * Date of Last Activity * Date Reported * Date Opened * Closed Date * Last Payment However, this inaccurate information is still being verified and reported by XXXX and the credit bureaus each month. The information can not be both valid and different. Each bureau is reporting different data in each category. I request the XXXX account XXXX be removed immediately from my credit report with XXXX XXXX XXXX XXXX and XXXX XXXX XXXX is in direct violation of my rights under FCRA by reporting inaccurately. 

Also when attempting to make contact in order to resolve my concern, XXXX refuses to assist and forwards me to Enhanced Recovery Company. When I contact Enhance Recovery, they inform me that XXXX is reporting to credit bureaus not ERC, therefor they can not assist with the inaccurate reporting. An ERC representative on the phone informed me they do not report data to credit agencies, they collect only and the information being provided is coming from XXXX XXXX. I have been sent back and forth between the two companies with no resolve. 

I can not verify or validate any of the information on my credit report concerning XXXX. I have contacted XXXX on several occasions but XXXX refuses to report accurately. 

I request account XXXX be deleted immediately from my credit report.","Credit reporting, credit repair services, or other personal consumer reports",Incorrect information on your report,ERC,12/3/2022,have reached out and enhanced recovery multiple occasions through several different avenues throughout this past year attempt dispute the following information that appears and report date last activity date reported date opened closed date last payment however this inaccurate information still being verified and reported and the credit bureaus each month the information can not both valid and different each bureau reporting different data each category request the account removed immediately from credit report with and direct violation rights under fcra reporting inaccurately also when attempting make contact order resolve concern refuses assist and forwards enhanced recovery company when contact enhance recovery they inform that reporting credit bureaus not erc therefor they can not assist with the inaccurate reporting erc representative the phone informed they not report data credit agencies they collect only and the information being provided coming from have been sent back and forth between the two companies with resolve can not verify validate any the information credit report concerning have contacted several occasions but refuses report accurately request account deleted immediately from credit report,177,3,4
"InXX/XX/XXXXXX/XX/XXXX I opened a XXXX account at the XXXX XXXX Location to buy a set of Cribs for my Sister in Laws ' baby shower for her XXXX. I opened this account because they sent me a {$1000.00} credit limit credit card in the mail. We spent about {$390.00} for the 2 cribs and one other item. We agreed to pay about {$94.00} a month for 4 months. We never recieved a paper copy of this contract. On Friday XX/XX/XXXX I called to make a payment. I asked the person how much was owed and he informed me that one of the payments was passed due but not 30 days past due. He told me that 2 payments were due. I asked him to take one payment, on a recorded line, on my debit card and that I would call the following week to bring the account current. When the charge came through my bank, I realized he had in fact charged us 2 payments and the amount taken was {$190.00}. I called back the very same day and explained to the person I spoke with that I authorized them to charge me only one payment and not 2 payments and the representative charged us 2 payments. He assured me that he would issue a refund and that the refund would come back to us the following week 3-5 business days later. He then informed me that because he issued a refund the account would be passed due unless I paid an additional payment. So I paid an additional payment with the understanding that the refund would be issued the following week. He also informed me that my bank account would not show the new charge until Monday XX/XX/XXXX because the business day had closed by then. So Monday, XX/XX/XXXX the third charge of {$100.00} was taken out of our ccount. No refund was ever issued for these 3 payments. I called the company on a weekly and sometimes daily frequency to get the refund issued and was passed from representative to representative over the course of the next several months and the refund was still never issued. Because of this triple charge other things on the account were not able to be paid and there were overdraft fees and a whole bunch of problems with our bank because of these charges that were never authorized. I eventually had to contact XXXX XXXX XXXX XXXX ( my bank ) and ask them to pursue the company for the triple charge. A dispute was filed, and eventually XXXX was forced to issue the refund. Once they finally issued the refund several months later at the end of XX/XX/XXXX, the dipute was lifted and I paid the account to current in 2 payments of {$210.00} on XX/XX/XXXX, and XX/XX/XXXX to close the account. Once the dispute was complete, they penalized me by reporting to all 3 credit bureaus that my account was 90 days, and 60 days past due even though there was an active dipuste ( This is account FTC laws as I understand them ). This has prevented us from being able to get a mortgage and highly impacted my credit scores. However, this was not the end of the issue. We were unaware that they reported this account 90-60 days past due as this showed up on our credit later, and we got another account with them. They had to run our credit again and gave us a different credit limit and opened a new account on our credit reports. This new account was paid earlier than agreed and closed in XX/XX/XXXX, yet it is still reporting open and with late payments. The current account that is reporting that it was 90 days and 60 days late was in fact opened in XX/XX/XXXX. How is it possible for it to have been 90 days late and 60 days late in XXXX, XXXX, XXXX, and XX/XX/XXXX if it wasn't opened in XX/XX/XXXX? I have approached the company asking them to coorect these various issues. Each time I call I am given a different answer, I called once they told me it would be deleted within 3-5 business days, then I was told they can't delete it because it was in fact late even though there was an open dispute, then they told me they would escalate it and return my call, and each time the account remains the same and now when I call they transfer me directly to a voicemail and my call is never returned. I have disputed this account on the credit beruaes to no avail.","Credit reporting, credit repair services, or other personal consumer reports",Incorrect information on your report,ERC,6/7/2020,inxx opened account the location buy set cribs for sister laws baby shower for her opened this account because they sent credit limit credit card the mail spent about for the cribs and one other item agreed pay about month for months never recieved paper copy this contract friday called make payment asked the person how much was owed and informed that one the payments was passed due but not days past due told that payments were due asked him take one payment recorded line debit card and that would call the following week bring the account current when the charge came through bank realized had fact charged payments and the amount taken was called back the very same day and explained the person spoke with that authorized them charge only one payment and not payments and the representative charged payments assured that would issue refund and that the refund would come back the following week business days later then informed that because issued refund the account would passed due unless paid additional payment paid additional payment with the understanding that the refund would issued the following week also informed that bank account would not show the new charge until monday because the business day had closed then monday the third charge was taken out our ccount refund was ever issued for these payments called the company weekly and sometimes daily frequency get the refund issued and was passed from representative representative over the course the next several months and the refund was still never issued because this triple charge other things the account were not able paid and there were overdraft fees and whole bunch problems with our bank because these charges that were never authorized eventually had contact bank and ask them pursue the company for the triple charge dispute was filed and eventually was forced issue the refund once they finally issued the refund several months later the end the dipute was lifted and paid the account current payments and close the account once the dispute was complete they penalized reporting all credit bureaus that account was days and days past due even though there was active dipuste this account ftc laws understand them this has prevented from being able get mortgage and highly impacted credit scores however this was not the end the issue were unaware that they reported this account days past due this showed our credit later and got another account with them they had run our credit again and gave different credit limit and opened new account our credit reports this new account was paid earlier than agreed and closed yet still reporting open and with late payments the current account that reporting that was days and days late was fact opened how possible for have been days late and days late and wasn opened have approached the company asking them coorect these various issues each time call given different answer called once they told would deleted within business days then was told they can delete because was fact late even though there was open dispute then they told they would escalate and return call and each time the account remains the same and now when call they transfer directly voicemail and call never returned have disputed this account the credit beruaes avail,550,2,1
XXXX has not updated the account owned by ENHANCED RECOVERY COMPANY.it has been investigated and this account was removed completely from my report. Please can you please remove it to. Please dont close it. Please remove it I read closed account can have negative impact on credit report. Im trying very hard to fix my credit. I disputed this on XX/XX/19. Dispute report # is XXXX,"Credit reporting, credit repair services, or other personal consumer reports",Incorrect information on your report,ERC,9/20/2019,has not updated the account owned enhanced recovery company has been investigated and this account was removed completely from report please can you please remove please dont close please remove read closed account can have negative impact credit report trying very hard fix credit disputed this dispute report,48,1,5
"Enhanced recovery erroneously created a 1-month debt collection on my XXXX   credit report. I discovered this while applying for a home loan. They put on as a debt in XXXX and said it was paid in XXXX. Leaving on my XXXX Credit report. I am requesting that this company immediately delete this entry in my report. 

6. ENHANCED RECOVERY CO XXXX XXXX XXXX ) Decode XXXX I XXXX XXXX XXXX CLOSED XXXX CURRENT XXXX XXXX XXXX XXXX XXXX XXXX Hist : XXXX XXXX CLSD XXXX APP Ctgy : COLLECTION Term : 1 MO ACCT SUBMITTED TO COLLECTION PAID 14. ENHANCED RECOVERY CO L ( XXXX ) ( XXXX ) XXXX, XXXX XXXX XXXX, XXXX, FL XXXX",Debt collection,False statements or representation,ERC,12/2/2019,enhanced recovery erroneously created month debt collection credit report discovered this while applying for home loan they put debt and said was paid leaving credit report requesting that this company immediately delete this entry report enhanced recovery decode closed current hist clsd app ctgy collection term acct submitted collection paid enhanced recovery,52,2,1
Phone service was suppose to be disconnected. Because I was lied to about services offered. They waited longer period of time to disconnect and then wanted to charge me more.,Debt collection,False statements or representation,ERC,8/19/2016,phone service was suppose disconnected because was lied about services offered they waited longer period time disconnect and then wanted charge more,22,2,1
Enhanced recovery corporation has been trying to collect a debt on behalf of XXXX. The issue is this debt is well over 7 years old and several times throughout the past few years enhanced recovery renews it and restarts the clock. I have had 0 communication with the company during this time and need these removed permanently from my report. I have disputed them in the past and has them removed only to have them come back with a new open date.,Debt collection,False statements or representation,ERC,7/9/2020,enhanced recovery corporation has been trying collect debt behalf the issue this debt well over years old and several times throughout the past few years enhanced recovery renews and restarts the clock have had communication with the company during this time and need these removed permanently from report have disputed them the past and has them removed only have them come back with new open date,66,1,4
"ERC Collection Creditor Phone Number XXXX XXXX XXXX XXXX Creditor Address XXXX XXXX XXXX XXXX, FL XXXX This company has re-aged a collection account. The date opened is being reported as XX/XX/XXXX however, this account was placed for collection with the Original Creditor - XXXX - in XX/XX/XXXX. This is a clear violation of FCRA laws.",Debt collection,False statements or representation,ERC,9/18/2017,erc collection creditor phone number creditor address this company has aged collection account the date opened being reported however this account was placed for collection with the original creditor this clear violation fcra laws,34,2,4
"Enhanced Recovery collection is reporting on my credit reports a bill, that has been on my credit reports on and off for over 20 YEARS. The account # XXXX first appeared on my credit report in XXXX XXXX with XXXX. 

It was then sold to XXXX XXXX and re reported with account # XXXX in XXXX of XXXX. 

It was then sold to XXXX and re reported with account # XXXX in XXXX XXXX. 

It was then sold to XXXX XXXX and re reported with account # XXXX in XXXX XXXX. 

It was then sold to XXXX XXXX and re reported with account # XXXX in XXXX XXXX. 

It was then sold to XXXX. XXXX XXXX and re reported with account # XXXX in XXXX XXXX. 

It has now been sold to Enhanced Recovery Collections with the account # XXXX in XXXX XXXX and updated by Enhanced Recovery Collections in XXXX XXXX.",Debt collection,False statements or representation,ERC,7/1/2015,enhanced recovery collection reporting credit reports bill that has been credit reports and off for over years the account first appeared credit report with was then sold and reported with account was then sold and reported with account was then sold and reported with account was then sold and reported with account was then sold and reported with account has now been sold enhanced recovery collections with the account and updated enhanced recovery collections,74,4,4
"On XXXX/XXXX/16 ERC ( a collection company in XXXX FL ) sent a collection letter to my California home address, with a name similar to mine ( with incorrect spelling ), claiming that I owe a debt for services never solicited or rendered. I have never had XXXX XXXX XXXX services at my home. For the past 8 years my landlord has provided all utilities ( including our XXXX XXXX XXXX XXXX cable services ) in her name. I am concerned about fraud on the part of ERC, XXXX XXXX XXXX or an unidentified third party individual. ERC states in the bill sent to my address that these charges will be validated if I fail to respond within 30 days. This is not my debt.",Debt collection,False statements or representation,ERC,11/15/2016,erc collection company sent collection letter california home address with name similar mine with incorrect spelling claiming that owe debt for services never solicited rendered have never had services home for the past years landlord has provided all utilities including our cable services her name concerned about fraud the part erc unidentified third party individual erc states the bill sent address that these charges will validated fail respond within days this not debt,73,1,4
"XXXX and Enhanced Recovery. I was a XXXX customer for years while living in XXXX. In XXXX, I moved to XXXX and the phone service basically did not work. For 6 months I complained to the company about the dropped calls and no service and there was nothing they did. I kept asking to be let out of the contract so I can get a different phone company because their service did not work well or sometime NOT AT ALL in XXXX at that time. XXXX breached the contract because they did not provide the service I was paying for. I stopped paying for the service because I was not getting any service. They should not be able to charge me for service they could not provide. I was not going to continue to pay for service that I was not receiving. This was in XXXX and this year, their collection agency re-put this on my credit. XXXX would not remove this from my report. This is not fair that a company can keep putting a claim on my account when they are the cause of the cost.",Debt collection,False statements or representation,ERC,12/27/2019,and enhanced recovery was customer for years while living moved and the phone service basically did not work for months complained the company about the dropped calls and service and there was nothing they did kept asking let out the contract can get different phone company because their service did not work well sometime not all that time breached the contract because they did not provide the service was paying for stopped paying for the service because was not getting any service they should not able charge for service they could not provide was not going continue pay for service that was not receiving this was and this year their collection agency put this credit would not remove this from report this not fair that company can keep putting claim account when they are the cause the cost,138,2,1
This company is reporting this incorrect debt under two different company names using same address out of XXXX fl. XXXX XXXX and XXXX XXXX. They are also reporting the account is less than a year old under XXXX XXXX  and 3 years old under XXXX XXXX. The original account was with XXXX more than 15 yrs ago when XXXX  bought XXXX. The account has been closed more than 7yrs because of charges by XXXX that were incorrect which lead to the termination of relationship with XXXX.,Debt collection,False statements or representation,ERC,1/21/2019,this company reporting this incorrect debt under two different company names using same address out and they are also reporting the account less than year old under and years old under the original account was with more than yrs ago when bought the account has been closed more than yrs because charges that were incorrect which lead the termination relationship with,61,2,4
Years ago I had a cell phone account with XXXX XXXX XXXX. I went through the proper steps to close the account and moved to a different provider. XXXX XXXX XXXX continued to send me bills for service in which I had ended. I repeatedly called their customer service and they would say it has been resolved. Years later I continued getting a bill saying I owed for service in which I did not have. I learned later that XXXX XXXX XXXX has class action suits against them for the same practices. Eventually they turned my bill over to a collection agency in which I have zero correspondence. It shows on my credit report.. XXXX XXXX XXXX has XXXX tactics and poor customer service. If they were to pull up the account for the dates years ago they would see that there was no active account and no activity on the account. I think with research it will be found that XXXX XXXX XXXX has done this with many others.,Debt collection,False statements or representation,ERC,1/23/2018,years ago had cell phone account with went through the proper steps close the account and moved different provider continued send bills for service which had ended repeatedly called their customer service and they would say has been resolved years later continued getting bill saying owed for service which did not have learned later that has class action suits against them for the same practices eventually they turned bill over collection agency which have zero correspondence shows credit report has tactics and poor customer service they were pull the account for the dates years ago they would see that there was active account and activity the account think with research will found that has done this with many others,119,2,1
ERC is fraudulently reporting my credit information and re-aging my account. They are fraudulently reporting the account as being 1yr and 11months old when in fact the account is close to 6 years old in order to prevent the account from closing due to reaching statute of limitations.,Debt collection,False statements or representation,ERC,1/14/2017,erc fraudulently reporting credit information and aging account they are fraudulently reporting the account being and months old when fact the account close years old order prevent the account from closing due reaching statute limitations,35,5,4
I have not had a contract with  XXXX . The Debt is not mines. the creditors continue to remove the debt and then reinsert it back on my credit with a new date,Debt collection,False statements or representation,ERC,5/1/2017,have not had contract with the debt not mines the creditors continue remove the debt and then reinsert back credit with new date,23,3,4
"In the year of 2013, I contracted XXXX as my cell phone provider with XXXX phone lines. 
As time went out I realized that XXXX had not a good cellphone coverage where I live, I contacted customer support and was given the run around, they told me that I could cancel. Never told me that I had to pay for the cancellation of the lines. 
Next thing you know, I started getting harassing calls from Debt Collector trying to collect {$1500.00} for cancellation. The caller gave me a settlement for $ XXXX put me on a payment plan that everytime I would get paid the money would be taken out in which I agreed. 
after paying the {$1000.00} I noticed that they continued to take out an extra {$200.00}. I called and asked them why, and they said that since I did n't pay the account in one month the settlement would have been cancelled- they failed at telling me this. 
Now I have a balance of {$350.00} and sent me to collections which has affected my credit- they lied to me so for a {$1500.00} I paid {$1200.00} which was {$200.00} over our agreement and now I 'm in collections! Please help me.",Debt collection,False statements or representation,ERC,6/10/2015,the year contracted cell phone provider with phone lines time went out realized that had not good cellphone coverage where live contacted customer support and was given the run around they told that could cancel never told that had pay for the cancellation the lines next thing you know started getting harassing calls from debt collector trying collect for cancellation the caller gave settlement for put payment plan that everytime would get paid the money would taken out which agreed after paying the noticed that they continued take out extra called and asked them why and they said that since did pay the account one month the settlement would have been cancelled they failed telling this now have balance and sent collections which has affected credit they lied for paid which was over our agreement and now collections please help,140,2,1
